{
  "$schema": "http://json-schema.org/draft-07/schema#",
  "$id": "https://devlingo.app/schemas/question.schema.json",
  "title": "DevLingo question bank",
  "description": "Formato de um arquivo de licao do DevLingo. Cada arquivo contem uma licao com N questoes.",
  "type": "object",
  "required": ["schemaVersion", "language", "level", "lessonId", "lessonTitle", "questions"],
  "additionalProperties": false,
  "properties": {
    "aula": {
      "description": "Apresentacao que o Tr0nikAt faz ANTES das questoes, cobrindo o beabá que elas exigem. Opcional no esquema para nao quebrar licoes antigas, mas o validador avisa quando falta: sem ela o jogador cai de paraquedas. Mora no mesmo arquivo das questoes de proposito, para aula e questoes nao poderem divergir.",
      "type": "object",
      "required": ["titulo", "secoes"],
      "additionalProperties": false,
      "properties": {
        "titulo": { "type": "string", "minLength": 3, "maxLength": 60 },
        "secoes": {
          "type": "array",
          "minItems": 1,
          "items": {
            "type": "object",
            "required": ["topico", "titulo", "texto"],
            "additionalProperties": false,
            "properties": {
              "topico": {
                "description": "Qual topic das questoes esta secao prepara. E o que permite ao validador conferir, por conjunto e nao por semelhanca de texto, que a aula cobre tudo o que sera cobrado.",
                "type": "string",
                "minLength": 2
              },
              "titulo": { "type": "string", "minLength": 3, "maxLength": 60 },
              "texto": { "type": "string", "minLength": 30 },
              "code": { "$ref": "#/definitions/codeBlock" }
            }
          }
        }
      }
    },
    "schemaVersion": {
      "description": "Versao do formato. Permite o app ler arquivos antigos sem quebrar.",
      "type": "integer",
      "const": 1
    },
    "language": {
      "description": "Linguagem de programacao ensinada nesta licao.",
      "type": "string",
      "enum": ["python", "javascript", "node", "backend", "qa", "frameworks", "java", "selenium", "agentes", "html", "css", "sql", "csharp", "golang", "cpp", "cobol", "ruby"]
    },
    "level": {
      "type": "string",
      "enum": ["beginner", "intermediate", "advanced"]
    },
    "lessonId": {
      "description": "Identificador imutavel da licao. Nunca reutilizar nem renumerar.",
      "type": "string",
      "pattern": "^[a-z]+-(beg|int|adv)-[0-9]{2}$"
    },
    "lessonTitle": {
      "type": "string",
      "minLength": 3,
      "maxLength": 60
    },
    "questions": {
      "type": "array",
      "minItems": 1,
      "items": { "$ref": "#/definitions/question" }
    }
  },
  "definitions": {
    "codeBlock": {
      "description": "Bloco de codigo exibido na IDE simulada. Usado tanto pelas questoes quanto pelas secoes da aula.",
      "type": "object",
      "required": ["language", "content"],
      "additionalProperties": false,
      "properties": {
        "language": {
          "description": "Usada apenas para o realce de sintaxe. Pode diferir da linguagem da licao.",
          "type": "string"
        },
        "content": {
          "type": "string",
          "minLength": 1
        },
        "highlightLine": {
          "description": "Linha destacada na IDE, contando a partir de 1.",
          "type": "integer",
          "minimum": 1
        }
      }
    },
    "question": {
      "type": "object",
      "required": ["id", "topic", "prompt", "answerType", "hint", "explanation"],
      "additionalProperties": false,
      "properties": {
        "id": {
          "description": "Identificador imutavel da questao. O progresso do usuario aponta para ele.",
          "type": "string",
          "pattern": "^[a-z]+-(beg|int|adv)-[0-9]{4}$"
        },
        "topic": {
          "description": "Assunto da questao. Base para revisao dirigida no futuro.",
          "type": "string",
          "minLength": 2
        },
        "prompt": {
          "description": "Enunciado em texto. Sempre presente, mesmo quando ha bloco de codigo.",
          "type": "string",
          "minLength": 5
        },
        "code": { "$ref": "#/definitions/codeBlock" },
        "answerType": {
          "description": "Como o usuario responde. Independente do que a questao mostra.",
          "type": "string",
          "enum": ["multipleChoice", "fillBlank", "freeWrite"]
        },
        "options": {
          "description": "Obrigatorio e exclusivo de multipleChoice. Sempre 5 itens, sempre 1 correto.",
          "type": "array",
          "minItems": 5,
          "maxItems": 5,
          "items": {
            "type": "object",
            "required": ["id", "text", "correct"],
            "additionalProperties": false,
            "properties": {
              "id": { "type": "string", "enum": ["a", "b", "c", "d", "e"] },
              "text": { "type": "string", "minLength": 1 },
              "correct": { "type": "boolean" },
              "why": {
                "description": "Opcional. Por que ESTA alternativa esta errada. Aparece no momento em que o aluno a escolhe, e nunca entrega qual e a certa: se entregasse, a eliminacao progressiva perderia o sentido. Nao existe na alternativa correta, cujo papel cabe a explanation.",
                "type": "string",
                "minLength": 10
              }
            }
          }
        },
        "accepted": {
          "description": "Obrigatorio para fillBlank e freeWrite. Lista de respostas consideradas certas.",
          "type": "array",
          "minItems": 1,
          "items": { "type": "string", "minLength": 1 }
        },
        "normalize": {
          "description": "O que ignorar antes de comparar a resposta escrita. spaces ignora apenas espacos irrelevantes (os que tocam pontuacao ou operador); o espaco obrigatorio entre duas palavras e sempre exigido.",
          "type": "object",
          "additionalProperties": false,
          "properties": {
            "spaces": { "type": "boolean", "default": true },
            "quotes": { "type": "boolean", "default": true },
            "trailingSemicolon": { "type": "boolean", "default": true },
            "caseSensitive": { "type": "boolean", "default": false }
          }
        },
        "hint": {
          "description": "Obrigatoria. Deve orientar o raciocinio sem entregar a resposta.",
          "type": "string",
          "minLength": 10
        },
        "explanation": {
          "description": "Obrigatoria. Exibida depois da resposta. E onde o aprendizado acontece.",
          "type": "string",
          "minLength": 10
        }
      },
      "allOf": [
        {
          "if": { "properties": { "answerType": { "const": "multipleChoice" } } },
          "then": { "required": ["options"], "not": { "required": ["accepted"] } }
        },
        {
          "if": { "properties": { "answerType": { "enum": ["fillBlank", "freeWrite"] } } },
          "then": { "required": ["accepted"], "not": { "required": ["options"] } }
        }
      ]
    }
  }
}
